<order xmlns:xsi="http://www.w3.org/2001/XMLSchema-instance"
       xsi:noNamespaceSchemaLocation="file://test.xsd">
    <shipTo>
        <name>name</name>
        <street>street</street>
    </shipTo>
    <billTo>
        <name>name</name>
        <street>street</street>
    </billTo>
    <comment>comment</comment>
</order>